shortDescription,company,vuln_type
"There is a vulnerability in the implementation of the Common Industrial Protocol (CIP) feature in Cisco IOS could allow an unauthenticated, remote attacker to cause an affected device to reload, resulting in a denial of service.",There,Denial of Service
"A vulnerability in the implementation of a protocol in Cisco Integrated Services Routers Generation 2 (ISR G2) Routers running Cisco IOS could allow an unauthenticated, adjacent attacker to cause an affected device to reload, resulting in a denial of service.",,Denial of Service
"A vulnerability in the implementation of Network Address Translation (NAT) functionality in Cisco IOS could allow an unauthenticated, remote attacker to cause a denial of service.",,Denial of Service
A remote code execution vulnerability exists in Microsoft Office software when the software fails to properly handle objects in memory. An attacker who successfully exploited the vulnerability could run arbitrary code in the context of the current user.,,Remote Code Execution
Adobe Flash Player contains a type confusion vulnerability which can allow for remote code execution.,Adobe Flash Player,Remote Code Execution
Microsoft Office contains a use-after-free vulnerability which can allow for remote code execution.,Microsoft Office,Remote Code Execution
"The Graphics Device Interface (GDI) in Microsoft Windows Vista SP2; Windows Server 2008 SP2 and R2 SP1; Windows 7 SP1; Windows 8.1; Windows Server 2012 Gold and R2; Windows RT 8.1; and Windows 10 Gold, 1511, and 1607 allows local users to gain privileges",Graphics Device Interface,
An improper privilege management vulnerability exists within the Siemens SIMATIC Communication Processor (CP) that allows a privileged attacker to remotely cause a denial of service.,An,Denial of Service
Use-after-free vulnerability in Adobe Flash Player Windows and OS and Linux allows remote attackers to execute arbitrary code.,Use-after-free,Remote Code Execution
A security feature bypass vulnerability exists when Microsoft Office improperly handles input. An attacker who successfully exploited the vulnerability could execute arbitrary commands.,,
Microsoft Office contains a memory corruption vulnerability which can allow for remote code execution.,Microsoft Office,Remote Code Execution
Race condition in mm/gup.c in the Linux kernel allows local users to escalate privileges.,Race,
An access of resource using incompatible type vulnerability exists within Adobe Flash Player that allows an attacker to perform remote code execution.,An,Remote Code Execution
Adobe Flash Player allows remote attackers to cause a denial of service or possibly execute arbitrary code.,Adobe Flash Player,Remote Code Execution
A privilege escalation vulnerability exists in Microsoft Windows if the Windows Secondary Logon Service fails to properly manage request handles in memory. An attacker who successfully exploited this vulnerability could run arbitrary code as an administrator.,,Privilege Escalation
Adobe Flash Player allows remote attackers to execute arbitrary code via a crafted SWF file.,Adobe Flash Player,Remote Code Execution
A use-after-free vulnerability exists within the ActionScript 3 ByteArray class in Adobe Flash Player that allows an attacker to perform remote code execution.,,Remote Code Execution
Unspecified vulnerability in Oracle Java SE allows remote attackers to affect integrity via Unknown vectors related to deployment.,Unspecified,
A memory corruption vulnerability exists in Adobe Flash Player that allows an attacker to perform remote code execution.,,Remote Code Execution
An unspecified vulnerability exists within Oracle Java Runtime Environment that allows an attacker to perform remote code execution.,An,Remote Code Execution
Microsoft Office allows remote attackers to execute arbitrary code via a crafted EPS image.,Microsoft Office,Remote Code Execution
Microsoft PowerPoint allows remote attackers to execute arbitrary code or cause a denial of service (memory corruption) via a crafted Office document.,Microsoft PowerPoint,Remote Code Execution
ATMFD.DLL in the Adobe Type Manager Font Driver in Microsoft Windows Server allows local users to gain privileges via a crafted application.,ATMFD.DLL,
An unspecified vulnerability exists in the Win32k.sys kernel-mode driver in Microsoft Windows Server that allows a local attacker to execute arbitrary code with elevated privileges.,An,Remote Code Execution
Microsoft Office contains a memory corruption vulnerability that allows remote attackers to execute arbitrary code via a crafted document.,Microsoft Office,Remote Code Execution
A vulnerability exists in Windows Object Linking & Embedding (OLE) that could allow remote code execution if a user opens a file that contains a specially crafted OLE object.,,Remote Code Execution
Adobe Reader and Acrobat contain a use-after-free vulnerability which can allow for code execution.,Adobe Reader,
Microsoft Windows NDProxy.sys in the kernel contains an improper input validation vulnerability which can allow a local attacker to escalate privileges.,Microsoft Windows NDProxy.sys,
A use-after-free vulnerability exists within CDisplayPointer in Microsoft Internet Explorer that allows an attacker to remotely execute arbitrary code.,,Remote Code Execution
Adobe Reader and Acrobat contain a memory corruption vulnerability which can allow attackers to execute arbitrary code or cause a denial of service.,Adobe Reader,Remote Code Execution
"Mozilla Firefox does not properly initialize data structures for the nsDOMSVGZoomEvent::mPreviousScale and nsDOMSVGZoomEvent::mNewScale functions, which allows remote attackers to obtain sensitive information from process memory via a crafted web site.",Mozilla Firefox,Information Disclosure
This vulnerability may corrupt memory in a way that could allow an attacker to execute arbitrary code in the context of the current user within Internet Explorer.,This,Remote Code Execution
A buffer overflow vulnerability exists in Adobe Reader which allows an attacker to perform remote code execution.,,Remote Code Execution
An memory corruption vulnerability exists in the acroform.dll in Adobe Reader that allows an attacker to perform remote code execution.,An,Remote Code Execution
An authentication bypass vulnerability exists in Adobe ColdFusion which could result in an unauthorized user gaining administrative access.,An,Authentication Bypass
The Java Runtime Environment (JRE) component in Oracle Java SE allow for remote code execution.,Java Runtime Environment,Remote Code Execution
The TabStrip ActiveX control in the Common Controls in MSCOMCTL.OCX in Microsoft Office allows remote attackers to execute arbitrary code via a crafted (1) document or (2) web page that triggers system-state corruption.,TabStrip ActiveX,Remote Code Execution
"Unspecified vulnerability in the Java Runtime Environment (JRE) component in Oracle Java SE allows remote attackers to affect confidentiality, integrity, and availability via Unknown vectors related to Hotspot.",Unspecified,
Unspecified vulnerability in Adobe Flash Player allows remote attackers to execute arbitrary code or cause a denial of service via crafted SWF content.,Unspecified,Remote Code Execution
An incorrect type vulnerability exists in the Concurrency component of Oracle's Java Runtime Environment allows an attacker to remotely execute arbitrary code.,An,Remote Code Execution
An access control vulnerability exists in the Applet Rhino Script Engine component of Oracle's Java Runtime Environment allows an attacker to remotely execute arbitrary code.,An,Remote Code Execution
A remote code execution vulnerability exists in the Forefront Threat Management Gateway (TMG) Firewall Client Winsock provider that could allow code execution in the security context of the client application.,,Remote Code Execution
Adobe Flash Player contains a vulnerability that allows remote attackers to execute arbitrary code or cause a denial of service (application crash) via crafted Flash content.,Adobe Flash Player,Remote Code Execution
A stack-based buffer overflow vulnerability exists in the parsing of RTF data in Microsoft Office and earlier allows an attacker to perform remote code execution.,,Remote Code Execution
"The kernel in Microsoft Windows, when access to 16-bit applications is enabled on a 32-bit x86 platform, does not properly validate certain BIOS calls, which allows local users to gain privileges.",The,
Unspecified vulnerability in Adobe Reader and Acrobat allows attackers to cause a denial of service or possibly execute arbitrary code.,Unspecified,Remote Code Execution
Microsoft Office Excel allows remote attackers to execute arbitrary code via a spreadsheet with a FEATHEADER record containing an invalid cbHdrData size element that affects a pointer offset.,Microsoft Office Excel,Remote Code Execution
"The kernel in Microsoft Windows does not properly validate changes to unspecified kernel objects, which allows local users to gain privileges via a crafted application.",The,
An input validation vulnerability exists in the VBoxDrv.sys driver of Sun xVM VirtualBox which allows attackers to locally execute arbitrary code.,An,Remote Code Execution
Adobe Acrobat and Reader contain an input validation issue in a JavaScript method that could potentially lead to remote code execution.,Adobe Acrobat,Remote Code Execution
A privilege elevation vulnerability exists in the POSIX subsystem. This vulnerability could allow a logged on user to take complete control of the system.,,
"smss.exe debugging subsystem in Microsoft Windows does not properly authenticate programs that connect to other programs, which allows local users to gain administrator or SYSTEM privileges.",,
Synacor Zimbra Collaboration Suite (ZCS) contains a cross-site scripting (XSS) vulnerability in the Calendar feature that allows an attacker to execute arbitrary code.,Synacor Zimbra Collaboration Suite,Remote Code Execution
A remote code execution vulnerability exists in Microsoft Office software when it fails to properly handle objects in memory.,,Remote Code Execution
A remote code execution vulnerability exists when Internet Explorer improperly accesses objects in memory.,,Remote Code Execution
Microsoft Windows allow remote attackers to execute arbitrary code via a crafted OLE object.,Microsoft Windows,Remote Code Execution
Unsafe client-side session storage leading to authentication bypass/instance takeover via Zabbix Frontend with configured SAML.,Unsafe,Authentication Bypass
Malicious actors can pass step checks and potentially change the configuration of Zabbix Frontend.,Malicious,
Adobe Commerce and Magento Open Source contain an improper input validation vulnerability which can allow for arbitrary code execution.,Adobe Commerce,Remote Code Execution
"Google Chromium Animation contains a use-after-free vulnerability that allows a remote attacker to potentially exploit heap corruption via a crafted HTML page. This vulnerability could affect multiple web browsers that utilize Chromium, including, but not limited to, Google Chrome, Microsoft Edge, and Opera.",Google Chromium Animation,a remote attacker to potentially exploit heap corruption via a crafted html page
A remote code execution vulnerability exists in the way that the scripting engine handles objects in memory in Internet Explorer,,Remote Code Execution
"A remote code execution vulnerability exists in the way that the VBScript engine handles objects in memory, aka ""Windows VBScript Engine Remote Code Execution""",,Remote Code Execution
WinRAR Absolute Path Traversal vulnerability leads to Remote Code Execution,WinRAR Absolute Path Traversal,Remote Code Execution
Adobe Flash Player com.adobe.tvsdk.mediacore.metadata Use After Free Vulnerability,Adobe Flash Player,
"PHPUnit allows remote attackers to execute arbitrary PHP code via HTTP POST data beginning with a ""<?php "" substring, as demonstrated by an attack on a site with an exposed /vendor folder, i.e., external access to the /vendor/phpunit/phpunit/src/Util/PHP/eval-stdin.php URI.",PHPUnit,
Microsoft Word contains a memory corruption vulnerability which when exploited could allow for remote code execution.,Microsoft Word,Remote Code Execution
Microsoft Graphics Component contains a memory corruption vulnerability which can allow for remote code execution.,Microsoft Graphics Component,Remote Code Execution
"Apple iOS, iPadOS, and macOS WebKit contain a use-after-free vulnerability that leads to code execution when processing maliciously crafted web content. This vulnerability could impact HTML parsers that use WebKit, including but not limited to Apple Safari and non-Apple products which rely on WebKit for HTML processing.",Apple,Denial of Service
"If a Volume Shadow Copy (VSS) shadow copy of the system drive is available, users can read the SAM file which would allow any user to escalate privileges to SYSTEM level.",If,
A remote code execution vulnerability exists in the way that the Microsoft Server Message Block 3.1.1 (SMBv3) protocol handles certain requests. An attacker who successfully exploited the vulnerability could gain the ability to execute code on the target server or client.,,Remote Code Execution
A code execution vulnerability exists in the Stapler web framework used by Jenkins,Jenkins,
The Struts 1 plugin in Apache Struts might allow remote code execution via a malicious field value passed in a raw message to the ActionMessage.,Struts,Remote Code Execution
Windows Shell in multiple versions of Microsoft Windows allows local users or remote attackers to execute arbitrary code via a crafted .LNK file,Windows Shell,Remote Code Execution
Oracle Corporation WebLogic Server contains a vulnerability that allows for remote code execution.,Oracle Corporation WebLogic Server,Remote Code Execution
Microsoft Win32k contains a privilege escalation vulnerability due to the Windows kernel-mode driver failing to properly handle objects in memory.,Microsoft Win32k,Privilege Escalation
A remote code execution vulnerability exists in Microsoft Office.,,Remote Code Execution
The SMBv1 server in multiple Microsoft Windows versions allows remote attackers to execute arbitrary code via crafted packets.,SMBv1,Remote Code Execution
The SMBv1 server in multiple Microsoft Windows versions allows remote attackers to execute arbitrary code via crafted packets.,SMBv1,Remote Code Execution
The Fileserver web application in Apache ActiveMQ allows remote attackers to upload and execute arbitrary files via an HTTP PUT followed by an HTTP MOVE request,Fileserver,
D-Link DIR-645 Wired/Wireless Router allows remote attackers to execute arbitrary commands via a GetDeviceSettings action to the HNAP interface.,D-Link DIR-645 Wired,
Microsoft HTTP protocol stack (HTTP.sys) contains a vulnerability that allows for remote code execution.,Microsoft HTTP,Remote Code Execution
The XPC implementation in Admin Framework in Apple OS X before 10.10.3 allows local users to bypass authentication and obtain admin privileges.,XPC,Authentication Bypass
"Heap-based buffer overflow in IOHIDFamily in Apple OS X, which affects, iOS before 8 and Apple TV before 7, allows attackers to execute arbitrary code in a privileged context.",Heap-based,Remote Code Execution
Microsoft Win32k contains an unspecified vulnerability that allows for privilege escalation.,Microsoft Win32k,Privilege Escalation
Apple IOMobileFrameBuffer contains a memory corruption vulnerability which can allow a malicious application to execute arbitrary code with kernel privileges.,Apple IOMobileFrameBuffer,Remote Code Execution
SonicWall SMA 100 devies are vulnerable to an unauthenticated stack-based buffer overflow vulnerability where exploitation can result in code execution.,SonicWall SMA,Buffer Overflow
Grandstream UCM6200 series is vulnerable to an unauthenticated remote SQL injection via crafted HTTP request. Exploitation can allow for code execution as root.,Grandstream UCM6200,SQL Injection
Microsoft Windows BITS is vulnerable to to a privilege elevation vulnerability if it improperly handles symbolic links. An actor can exploit this vulnerability to execute arbitrary code with system-level privileges.,Microsoft Windows BITS,Remote Code Execution
Intel products contain a vulnerability which can allow attackers to perform privilege escalation.,Intel,Privilege Escalation
Microsoft Internet Explorer contains a memory corruption vulnerability that allows remote attackers to execute code in the context of the current user.,Microsoft Internet Explorer,remote attackers to execute code in the context of the current user
"GNU Bash through 4.3 processes trailing strings after function definitions in the values of environment variables, which allows remote attackers to execute code.",GNU Bash,
"GNU Bash through 4.3 processes trailing strings after function definitions in the values of environment variables, which allows remote attackers to execute code. This CVE correctly remediates the vulnerability in CVE-2014-6271.",GNU Bash,
ActionForm in Apache Struts versions before 1.2.9 with BeanUtils 1.7 contains a vulnerability that allows for denial-of-service (DoS).,ActionForm,Denial of Service
The ExceptionDelegator component in Apache Struts 2 before 2.2.3.1 contains an improper input validation vulnerability that allows for remote code execution.,ExceptionDelegator,Remote Code Execution
Microsoft Windows Win32k contains a vulnerability that allows an attacker to escalate privileges.,Microsoft Windows Win32k,an attacker to escalate privileges
SolarWinds Serv-U versions 15.2.5 and earlier contain an improper input validation vulnerability that allows attackers to build and send queries without sanitization.,SolarWinds Serv-U,attackers to build and send queries without sanitization
In affected versions of the october/system package an attacker can request an account password reset and then gain access to the account using a specially crafted request.,In,
Nagios XI contains a vulnerability which can lead to OS command injection on the Nagios XI server.,Nagios XI,Command Injection
Nagios XI contains a vulnerability which can lead to OS command injection on the Nagios XI server.,Nagios XI,Command Injection
Nagios XI contains a vulnerability which can lead to OS command injection on the Nagios XI server.,Nagios XI,Command Injection
"Unrestricted upload of a file with a dangerous type is possible, which allows an unauthenticated user to execute arbitrary code via directory traversal.",Unrestricted,Remote Code Execution
Microsoft Exchange Server contains an information disclosure vulnerability which can allow an unauthenticated attacker to steal email traffic from target.,Microsoft Exchange Server,Information Disclosure
Server Side Request Forgery (SSRF) in vRealize Operations Manager API prior to 8.4 may allow a malicious actor with network access to the vRealize Operations Manager API to perform a SSRF attack to steal administrative credentials.,Server Side Request Forgery,
"In this vulnerability, an attacker can send a malicious payload that will exploit the name parameter. After successful exploitation, attackers can execute remote.",In,
"The Traffic Management Microkernel of BIG-IP ASM Risk Engine has a buffer overflow vulnerability, leading to a bypassing of URL-based access controls.",Traffic Management Microkernel,Buffer Overflow
"Path traversal vulnerability, where an attacker can target the preview FilePath parameter of the getPreviewImage function to get access to arbitrary system file.",Path,Directory Traversal
Improper sanitization in the extension file names is present in Drupal core.,Improper,
A remote code/command injection vulnerability was discovered in one of the example DAGs shipped with Airflow.,,Command Injection
The previous default setting for Airflow's Experimental API was to allow all API requests without authentication.,The,
Rhttproxy as used in vCenter Server contains a vulnerability due to improper implementation of URI normalization.,Rhttproxy,
A command injection vulnerability in the web server of some Hikvision product. Due to the insufficient input validation.,,Command Injection
Google Chrome Media contains a use-after-free vulnerability that allows a remote attacker to execute code via a crafted HTML page.,Google Chrome Media,a remote attacker to execute code via a crafted html page
"A privilege escalation vulnerability exists in Windows when the Win32k component fails to properly handle objects in memory, aka 'Win32k EoP.",,Privilege Escalation
A remote code execution vulnerability exists in the way that the WinVerifyTrust function handles Windows Authenticode signature verification for PE files.,,Remote Code Execution
Injection vulnerability in the Oracle WebLogic Server component of Oracle Fusion Middleware (subcomponent: Web Services).,Injection,
Synacor Zimbra Collaboration Suite (ZCS) contains an improper restriction of XML external entity (XXE) vulnerability in the mailboxd component.,Synacor Zimbra Collaboration Suite,
An Improper Authorization vulnerability in Fortinet FortiOS and FortiProxy under SSL VPN web portal allows an unauthenticated attacker to modify the password.,Improper Authorization,
A heap buffer overflow in Fortinet FortiOS and FortiProxy may cause the SSL VPN web service termination for logged in users.,,Buffer Overflow
Remote Code Execution in PAN-OS with GlobalProtect Portal or GlobalProtect Gateway Interface enabled.,Remote Code Execution,Remote Code Execution
Improper validation of recipient address in deliver_message() function in /src/deliver.c may lead to remote command execution.,Improper,Remote Code Execution
"Serialized-object interfaces in certain IBM analytics, business solutions, cognitive, IT infrastructure, and mobile and social products allow remote attackers to execute arbitrary commands",Serialized-object,
Primetek Primefaces is vulnerable to a weak encryption flaw resulting in remote code execution,Primetek Primefaces,Remote Code Execution
Kibana contain an arbitrary code execution flaw in the Timelion visualizer.,Kibana,
"A vulnerability in the web management interface of FatPipe WARP, IPVPN, and MPVPN software allows a remote, unauthenticated attacker to upload a file to any location on the filesystem.",,
"Microsoft Windows AppX Installer contains a spoofing vulnerability which has a high impacts to confidentiality, integrity, and availability.",Microsoft Windows AppX Installer,
"Google Chromium V8 Engine contains a use-after-free vulnerability that allows a remote attacker to potentially exploit heap corruption via a crafted HTML page. This vulnerability could affect multiple web browsers that utilize Chromium, including, but not limited to, Google Chrome, Microsoft Edge, and Opera.",Google Chromium V8 Engine,a remote attacker to potentially exploit heap corruption via a crafted html page
Zoho Desktop Central contains an authentication bypass vulnerability that could allow an attacker to execute arbitrary code in the Desktop Central MSP server.,Zoho Desktop Central,Remote Code Execution
Kernel/ptrace.c in Linux kernel mishandles contains an improper privilege management vulnerability that allows local users to obtain root access.,Kernel,local users to obtain root access
RealTek Jungle SDK contains multiple memory corruption vulnerabilities which can allow an attacker to perform remote code execution.,RealTek Jungle SDK,Remote Code Execution
Sonatype Nexus Repository Manager before 3.15.0 has an incorrect access control vulnerability. Exploitation allows for remote code execution.,Sonatype Nexus Repository Manager,Remote Code Execution
The optional Apache Solr module DataImportHandler contains a code injection vulnerability.,The,
"Fortinet FortiOS ""execute restore src-vis"" downloads code without integrity checking, allowing an attacker to arbitrarily download files.",Fortinet FortiOS,
Embedthis GoAhead before 3.6.5 allows remote code execution if CGI is enabled and a CGI program is dynamically linked.,Embedthis GoAhead,Remote Code Execution
"The JBoss Application Server, shipped with Red Hat Enterprise Application Platform 5.2, allows an attacker to execute arbitrary code via crafted serialized data.",JBoss Application Server,Remote Code Execution
"JBoss Seam 2 (jboss-seam2), as used in JBoss Enterprise Application Platform 4.3.0 for Red Hat Linux, allows attackers to perform remote code execution. This vulnerability can only be exploited when the Java Security Manager is not properly configured.",JBoss Seam,Remote Code Execution
"FUEL CMS 1.4.7 allows SQL Injection via the col parameter to /pages/items, /permissions/items, or /navigation/items.",FUEL CMS,SQL Injection
Pi-hole Web v4.3.2 (aka AdminLTE) allows Remote Code Execution by privileged dashboard users via a crafted DHCP static lease.,Pi-hole Web,Remote Code Execution
mongo-express before 0.54.0 is vulnerable to Remote Code Execution via endpoints that uses the `toBSON` method.,,Remote Code Execution
"Apache Log4j2 contains a vulnerability where JNDI features do not protect against attacker-controlled JNDI-related endpoints, allowing for remote code execution.",Apache Log4j2,Remote Code Execution
"Memory corruption due to improper check to return error when user application requests memory allocation of a huge size in Snapdragon Auto, Snapdragon Compute, Snapdragon Connectivity, Snapdragon Consumer IOT, Snapdragon Industrial IOT, Snapdragon Mobile, Snapdragon Voice & Music, Snapdragon Wearables",Memory,
MikroTik RouterOS through 6.42 allows unauthenticated remote attackers to read arbitrary files and remote authenticated attackers to write arbitrary files due to a directory traversal vulnerability in the WinBox interface.,MikroTik RouterOS,Directory Traversal
