shortDescription,company,vuln_type
Microsoft Windows Common Log File System (CLFS) driver contains a heap-based buffer overflow vulnerability that allows a local attacker to escalate privileges.,Microsoft Windows Common Log,Buffer Overflow
CyberPanel contains an incorrect default permissions vulnerability that allows for authentication bypass and the execution of arbitrary commands using shell metacharacters in the statusfile property.,CyberPanel,Authentication Bypass
Multiple Zyxel firewalls contain a path traversal vulnerability in the web management interface that could allow an attacker to download or upload files via a crafted URL.,Multiple Zyxel,Directory Traversal
"ProjectSend contains an improper authentication vulnerability that allows a remote, unauthenticated attacker to enable unauthorized modification of the application's configuration via crafted HTTP requests to options.php. Successful exploitation allows attackers to create accounts, upload webshells, and embed malicious JavaScript.",ProjectSend,a remote
"North Grid Proself Enterprise/Standard, Gateway, and Mail Sanitize contain an improper restriction of XML External Entity (XXE) reference vulnerability, which could allow a remote, unauthenticated attacker to conduct an XXE attack.",North Grid Proself Enterprise,
Array Networks AG and vxAG ArrayOS contain a missing authentication for critical function vulnerability that allows an attacker to read local files and execute code on the SSL VPN gateway.,Array Networks AG,an attacker to read local files and execute code on the ssl vpn gateway
Oracle Agile Product Lifecycle Management (PLM) contains an incorrect authorization vulnerability in the Process Extension component of the Software Development Kit. Successful exploitation of this vulnerability may result in unauthenticated file disclosure.,Oracle Agile Product Lifecycle,
"Apple iOS, macOS, and other Apple products contain an unspecified vulnerability when processing maliciously crafted web content that may lead to a cross-site scripting (XSS) attack.",Apple,Cross-Site Scripting
"Apple iOS, macOS, and other Apple products contain an unspecified vulnerability when processing maliciously crafted web content that may lead to arbitrary code execution.",Apple,
VMware vCenter contains an improper check for dropped privileges vulnerability. This vulnerability could allow an attacker with network access to the vCenter Server to escalate privileges to root by sending a specially crafted packet.,VMware,
VMware vCenter Server contains a heap-based buffer overflow vulnerability in the implementation of the DCERPC protocol. This vulnerability could allow an attacker with network access to the vCenter Server to execute remote code by sending a specially crafted packet.,VMware,Buffer Overflow
"Palo Alto Networks PAN-OS contains an OS command injection vulnerability that allows for privilege escalation through the web-based management interface for several PAN products, including firewalls and VPN concentrators.",Palo Alto Networks PAN-OS,Privilege Escalation
"Palo Alto Networks PAN-OS contains an authentication bypass vulnerability in the web-based management interface for several PAN-OS products, including firewalls and VPN concentrators.",Palo Alto Networks PAN-OS,Authentication Bypass
"Progress Kemp LoadMaster contains an OS command injection vulnerability that allows an unauthenticated, remote attacker to access the system through the LoadMaster management interface, enabling arbitrary system command execution.",Progress Kemp LoadMaster,Command Injection
"Palo Alto Networks Expedition contains a SQL injection vulnerability that allows an unauthenticated attacker to reveal Expedition database contents, such as password hashes, usernames, device configurations, and device API keys. With this, attackers can also create and read arbitrary files on the Expedition system.",Palo Alto Networks Expedition,SQL Injection
"Palo Alto Networks Expedition contains an OS command injection vulnerability that allows an unauthenticated attacker to run arbitrary OS commands as root in Expedition, resulting in disclosure of usernames, cleartext passwords, device configurations, and device API keys of PAN-OS firewalls.",Palo Alto Networks Expedition,Command Injection
Atlassian Jira Server and Data Center contain a path traversal vulnerability that allows a remote attacker to read particular files in the /WEB-INF/web.xml endpoint.,Atlassian Jira Server,Directory Traversal
Cisco Adaptive Security Appliance (ASA) contains a cross-site scripting (XSS) vulnerability in the WebVPN login page. This vulnerability allows remote attackers to inject arbitrary web script or HTML via an unspecified parameter.,Cisco Adaptive Security Appliance,Cross-Site Scripting
Metabase contains a local file inclusion vulnerability in the custom map support in the API to read GeoJSON formatted data.,Metabase,
Microsoft Windows contains an NTLMv2 hash spoofing vulnerability that could result in disclosing a user's NTLMv2 hash to an attacker via a file open operation. The attacker could then leverage this hash to impersonate that user.,Microsoft Windows,
"Microsoft Windows Task Scheduler contains a privilege escalation vulnerability that can allow an attacker-provided, local application to escalate privileges outside of its AppContainer, and access privileged RPC functions.",Microsoft Windows Task Scheduler,Privilege Escalation
Nostromo nhttpd contains a directory traversal vulnerability in the http_verify() function in a non-chrooted nhttpd server allowing for remote code execution.,Nostromo,Remote Code Execution
"CyberPanel contains an incorrect default permissions vulnerability that allows a remote, unauthenticated attacker to execute commands as root.",CyberPanel,a remote
Android Framework contains an unspecified vulnerability that allows for privilege escalation.,Android Framework,Privilege Escalation
"Palo Alto Networks Expedition contains a missing authentication vulnerability that allows an attacker with network access to takeover an Expedition admin account and potentially access configuration secrets, credentials, and other data.",Palo Alto Networks Expedition,an attacker with network access to takeover an expedition admin account and pote
"PTZOptics PT30X-SDI/NDI cameras contain an insecure direct object reference (IDOR) vulnerability that allows a remote, attacker to bypass authentication for the /cgi-bin/param.cgi CGI script. If combined with CVE-2024-8957, this can lead to remote code execution as root.",PTZOptics PT30X-SDI,Remote Code Execution
"PTZOptics PT30X-SDI/NDI cameras contain an OS command injection vulnerability that allows a remote, authenticated attacker to escalate privileges to root via a crafted payload with the ntp_addr parameter of the /cgi-bin/param.cgi CGI script. ",PTZOptics PT30X-SDI,Command Injection
RoundCube Webmail contains a cross-site scripting (XSS) vulnerability in the handling of SVG animate attributes that allows a remote attacker to run malicious JavaScript code.,RoundCube Webmail,Cross-Site Scripting
"Cisco Adaptive Security Appliance (ASA) and Firepower Threat Defense (FTD) contain a missing release of resource after effective lifetime vulnerability that could allow an unauthenticated, remote attacker to cause a denial-of-service (DoS) of the RAVPN service.",Cisco Adaptive Security Appliance,Remote Code Execution
"Fortinet FortiManager contains a missing authentication vulnerability in the fgfmd daemon that allows a remote, unauthenticated attacker to execute arbitrary code or commands via specially crafted requests.",Fortinet FortiManager,Remote Code Execution
Microsoft SharePoint contains a deserialization vulnerability that allows for remote code execution.,Microsoft SharePoint,Remote Code Execution
ScienceLogic SL1 (formerly EM7) is affected by an unspecified vulnerability involving an unspecified third-party component.,ScienceLogic SL1,
Veeam Backup and Replication contains a deserialization vulnerability allowing an unauthenticated user to perform remote code execution.,Veeam Backup,Remote Code Execution
"SolarWinds Web Help Desk contains a hardcoded credential vulnerability that could allow a remote, unauthenticated user to access internal functionality and modify data.",SolarWinds Web Help Desk,
Mozilla Firefox and Firefox ESR contain a use-after-free vulnerability in Animation timelines that allows for code execution in the content process.,Mozilla Firefox,
Microsoft Windows Kernel contains a time-of-check to time-of-use (TOCTOU) race condition vulnerability that could allow for privilege escalation. ,Microsoft Windows Kernel,Privilege Escalation
Ivanti Cloud Services Appliance (CSA) contains an OS command injection vulnerability in the administrative console which can allow an authenticated attacker with application admin privileges to pass commands to the underlying OS.,Ivanti Cloud Services Appliance,Command Injection
"Ivanti Cloud Services Appliance (CSA) contains a SQL injection vulnerability in the admin web console in versions prior to 5.0.2, which can allow a remote attacker authenticated as administrator to run arbitrary SQL statements.",Ivanti Cloud Services Appliance,SQL Injection
"Fortinet FortiOS, FortiPAM, FortiProxy, and FortiWeb contain a format string vulnerability that allows a remote, unauthenticated attacker to execute arbitrary code or commands via specially crafted requests.",Fortinet FortiOS,Remote Code Execution
Microsoft Windows MSHTML Platform contains an unspecified spoofing vulnerability which can lead to a loss of confidentiality.,Microsoft Windows MSHTML Platform,
Microsoft Windows Management Console contains unspecified vulnerability that allows for remote code execution.,Microsoft Windows Management Console,Remote Code Execution
Multiple Qualcomm chipsets contain a use-after-free vulnerability due to memory corruption in DSP Services while maintaining memory maps of HLOS memory. ,Multiple Qualcomm,
Synacor Zimbra Collaboration Suite (ZCS) contains an unspecified vulnerability in the postjournal service that may allow an unauthenticated user to execute commands.,Synacor Zimbra Collaboration Suite,
Ivanti Endpoint Manager (EPM) contains a SQL injection vulnerability in Core server that allows an unauthenticated attacker within the same network to execute arbitrary code. ,Ivanti Endpoint Manager,Remote Code Execution
SAP Commerce Cloud (formerly known as Hybris) contains a deserialization of untrusted data vulnerability within the mediaconversion and virtualjdbc extension that allows for code injection.,SAP Commerce Cloud,Remote Code Execution
"DrayTek Vigor3900, Vigor2960, and Vigor300B devices contain an OS command injection vulnerability in cgi-bin/mainfunction.cgi/cvmcfgupload that allows for remote code execution via shell metacharacters in a filename when the text/x-python-script content type is used.",DrayTek Vigor3900,Remote Code Execution
"D-Link DIR-820 routers contain an OS command injection vulnerability that allows a remote, unauthenticated attacker to escalate privileges to root via a crafted payload with the ping_addr parameter to ping.ccp.",D-Link DIR-820,Command Injection
"Ivanti Virtual Traffic Manager contains an authentication bypass vulnerability that allows a remote, unauthenticated attacker to create a chosen administrator account.",Ivanti Virtual Traffic Manager,Authentication Bypass
"Ivanti Cloud Services Appliance (CSA) contains a path traversal vulnerability that could allow a remote, unauthenticated attacker to access restricted functionality. If CVE-2024-8963 is used in conjunction with CVE-2024-8190, an attacker could bypass admin authentication and execute arbitrary commands on the appliance.",Ivanti Cloud Services Appliance,Directory Traversal
"Oracle WebLogic Server, a product within the Fusion Middleware suite, contains a deserialization vulnerability. Unauthenticated attackers with network access via T3 or IIOP can exploit this vulnerability to achieve remote code execution.",Oracle WebLogic Server,Remote Code Execution
"Oracle ADF Faces library, included with Oracle JDeveloper Distribution, contains a deserialization of untrusted data vulnerability leading to unauthenticated remote code execution.",Oracle ADF Faces,Remote Code Execution
Microsoft SQL Server Reporting Services contains a deserialization vulnerability when handling page requests incorrectly. An authenticated attacker can exploit this vulnerability to execute code in the context of the Report Server service account.,Microsoft SQL Server Reporting,
Apache HugeGraph-Server contains an improper access control vulnerability that could allow a remote attacker to execute arbitrary code.,Apache HugeGraph-Server,Remote Code Execution
Adobe Flash Player contains a double free vulnerability that allows a remote attacker to execute arbitrary code.,Adobe Flash Player,Remote Code Execution
Adobe Flash Player contains an unspecified vulnerability in the ExternalInterface ActionScript functionality that allows a remote attacker to execute arbitrary code via crafted SWF content.,Adobe Flash Player,Remote Code Execution
Adobe Flash Player contains an incorrect default permissions vulnerability in the Firefox sandbox that allows a remote attacker to execute arbitrary code via crafted SWF content. ,Adobe Flash Player,Remote Code Execution
Adobe Flash Player contains an integer underflow vulnerability that allows a remote attacker to execute arbitrary code.,Adobe Flash Player,Remote Code Execution
Progress WhatsUp Gold contains a SQL injection vulnerability that allows an unauthenticated attacker to retrieve the user's encrypted password if the application is configured with only a single user.,Progress WhatsUp Gold,SQL Injection
Microsoft Windows MSHTML Platform contains a user interface (UI) misrepresentation of critical information vulnerability that allows an attacker to spoof a web page. This vulnerability was exploited in conjunction with CVE-2024-38112.,Microsoft Windows MSHTML Platform,an attacker to spoof a web page
Ivanti Cloud Services Appliance (CSA) contains an OS command injection vulnerability in the administrative console which can allow an authenticated attacker with application admin privileges to pass commands to the underlying OS.,Ivanti Cloud Services Appliance,Command Injection
"Microsoft Windows Mark of the Web (MOTW) contains a protection mechanism failure vulnerability that allows an attacker to bypass MOTW-based defenses. This can result in a limited loss of integrity and availability of security features such as Protected View in Microsoft Office, which rely on MOTW tagging.",Microsoft Windows Mark,an attacker to bypass motw-based defenses
Microsoft Windows Installer contains an improper privilege management vulnerability that could allow an attacker to gain SYSTEM privileges.,Microsoft Windows Installer,
Microsoft Publisher contains a protection mechanism failure vulnerability that allows attacker to bypass Office macro policies used to block untrusted or malicious files.,Microsoft Publisher,attacker to bypass office macro policies used to block untrusted or malicious fi
"SonicWall SonicOS contains an improper access control vulnerability that could lead to unauthorized resource access and, under certain conditions, may cause the firewall to crash.",SonicWall SonicOS,Remote Code Execution
Linux kernel contains a position-independent executable (PIE) stack buffer corruption vulnerability in load_elf_ binary() that allows a local attacker to escalate privileges. ,Linux,
"ImageMagick contains an improper input validation vulnerability that affects the EPHEMERAL, HTTPS, MVG, MSL, TEXT, SHOW, WIN, and PLT coders. This allows a remote attacker to execute arbitrary code via shell metacharacters in a crafted image.",ImageMagick,Remote Code Execution
Kingsoft WPS Office contains a path traversal vulnerability in promecefpluginhost.exe on Windows that allows an attacker to load an arbitrary Windows library.,Kingsoft WPS Office,Directory Traversal
Draytek VigorConnect contains a path traversal vulnerability in the file download functionality of the WebServlet endpoint. An unauthenticated attacker could leverage this vulnerability to download arbitrary files from the underlying operating system with root privileges.,Draytek VigorConnect,Directory Traversal
Draytek VigorConnect contains a path traversal vulnerability in the DownloadFileServlet endpoint. An unauthenticated attacker could leverage this vulnerability to download arbitrary files from the underlying operating system with root privileges. ,Draytek VigorConnect,Directory Traversal
"Google Chromium V8 contains an inappropriate implementation vulnerability that allows a remote attacker to potentially exploit heap corruption via a crafted HTML page. This vulnerability could affect multiple web browsers that utilize Chromium, including, but not limited to, Google Chrome, Microsoft Edge, and Opera.",Google Chromium V8,a remote attacker to potentially exploit heap corruption via a crafted html page
Apache OFBiz contains an incorrect authorization vulnerability that could allow remote code execution via a Groovy payload in the context of the OFBiz user process by an unauthenticated attacker.,Apache OFBiz,Remote Code Execution
"Google Chromium V8 contains a type confusion vulnerability that allows a remote attacker to exploit heap corruption via a crafted HTML page. This vulnerability could affect multiple web browsers that utilize Chromium, including, but not limited to, Google Chrome, Microsoft Edge, and Opera.",Google Chromium V8,a remote attacker to exploit heap corruption via a crafted html page
"The Versa Director GUI contains an unrestricted upload of file with dangerous type vulnerability that allows administrators with Provider-Data-Center-Admin or Provider-Data-Center-System-Admin privileges to customize the user interface. The “Change Favicon” (Favorite Icon) enables the upload of a .png file, which can be exploited to upload a malicious file with a .png extension disguised as an image.",Versa Director GUI,administrators with provider-data-center-admin or provider-data-center-system-ad
Microsoft Exchange Server contains an information disclosure vulnerability that allows for remote code execution.,Microsoft Exchange Server,Remote Code Execution
Linux kernel contains a heap-based buffer overflow vulnerability in the legacy_parse_param function in the Filesystem Context functionality. This allows an attacker to open a filesystem that does not support the Filesystem Context API and ultimately escalate privileges.,Linux,Buffer Overflow
Dahua IP cameras and related products contain an authentication bypass vulnerability when the loopback device is specified by the client during authentication.,Dahua IP,Authentication Bypass
Dahua IP cameras and related products contain an authentication bypass vulnerability when the NetKeyboard type argument is specified by the client during authentication.,Dahua IP,Authentication Bypass
"Jenkins Command Line Interface (CLI) contains a path traversal vulnerability that allows attackers limited read access to certain files, which can lead to code execution.",Jenkins Command Line Interface,Directory Traversal
SolarWinds Web Help Desk contains a deserialization of untrusted data vulnerability that could allow for remote code execution.,SolarWinds Web Help Desk,Remote Code Execution
"Microsoft Windows Power Dependency Coordinator contains an unspecified vulnerability that allows for privilege escalation, enabling a local attacker to obtain SYSTEM privileges.",Microsoft Windows Power Dependency,Privilege Escalation
"Microsoft Windows Kernel contains an unspecified vulnerability that allows for privilege escalation, enabling a local attacker to gain SYSTEM privileges. Successful exploitation of this vulnerability requires an attacker to win a race condition.",Microsoft Windows Kernel,Privilege Escalation
"Microsoft Windows Ancillary Function Driver for WinSock contains an unspecified vulnerability that allows for privilege escalation, enabling a local attacker to gain SYSTEM privileges.",Microsoft Windows Ancillary Function,Privilege Escalation
Microsoft Windows SmartScreen contains a security feature bypass vulnerability that allows an attacker to bypass the SmartScreen user experience via a malicious file.,Microsoft Windows SmartScreen,an attacker to bypass the smartscreen user experience via a malicious file
Microsoft Windows Scripting Engine contains a memory corruption vulnerability that allows unauthenticated attacker to initiate remote code execution via a specially crafted URL.,Microsoft Windows Scripting Engine,Remote Code Execution
Microsoft Project contains an unspecified vulnerability that allows for remote code execution via a malicious file.,Microsoft Project,Remote Code Execution
Apache OFBiz contains a path traversal vulnerability that could allow for remote code execution.,Apache OFBiz,Remote Code Execution
"Android contains an unspecified vulnerability in the kernel that allows for remote code execution. This vulnerability resides in Linux Kernel and could impact other products, including but not limited to Android OS.",Android,Remote Code Execution
Microsoft COM for Windows contains a deserialization of untrusted data vulnerability that allows for privilege escalation and remote code execution via a specially crafted file or script.,Microsoft COM,Remote Code Execution
VMware ESXi contains an authentication bypass vulnerability. A malicious actor with sufficient Active Directory (AD) permissions can gain full access to an ESXi host that was previously configured to use AD for user management by re-creating the configured AD group ('ESXi Admins' by default) after it was deleted from AD.,VMware ESXi,Authentication Bypass
Acronis Cyber Infrastructure (ACI) allows an unauthenticated user to execute commands remotely due to the use of default passwords.,Acronis Cyber Infrastructure,
"ServiceNow Washington DC, Vancouver, and earlier Now Platform releases contain an incomplete list of disallowed inputs vulnerability in the GlideExpression script. An unauthenticated user could exploit this vulnerability to execute code remotely.",ServiceNow Washington DC,
"ServiceNow Utah, Vancouver, and Washington DC Now Platform releases contain a jelly template injection vulnerability in UI macros. An unauthenticated user could exploit this vulnerability to execute code remotely. ",ServiceNow Utah,
Twilio Authy contains an information disclosure vulnerability in its API that allows an unauthenticated endpoint to accept a request containing a phone number and respond with information about whether the phone number was registered with Authy.,Twilio Authy,Information Disclosure
"Microsoft Internet Explorer contains a use-after-free vulnerability that allows a remote attacker to execute arbitrary code via a crafted web site that triggers access to an object that (1) was not properly allocated or (2) is deleted, as demonstrated by a CDwnBindInfo object.",Microsoft Internet Explorer,Remote Code Execution
"VMware vCenter Server contains an incorrect default file permissions vulnerability that allows a remote, privileged attacker to gain access to sensitive information.",VMware,Information Disclosure
SolarWinds Serv-U contains a path traversal vulnerability that allows an attacker access to read sensitive files on the host machine.,SolarWinds Serv-U,Directory Traversal
Adobe Commerce and Magento Open Source contain an improper restriction of XML external entity reference (XXE) vulnerability that allows for remote code execution.,Adobe Commerce,Remote Code Execution
OSGeo GeoServer GeoTools contains an improper neutralization of directives in dynamically evaluated code vulnerability due to unsafely evaluating property names as XPath expressions. This allows unauthenticated attackers to conduct remote code execution via specially crafted input.,OSGeo GeoServer GeoTools,Remote Code Execution
"Rejetto HTTP File Server contains an improper neutralization of special elements used in a template engine vulnerability. This allows a remote, unauthenticated attacker to execute commands on the affected system by sending a specially crafted HTTP request.",Rejetto HTTP File Server,
Microsoft Windows Hyper-V contains a privilege escalation vulnerability that allows a local attacker with user permissions to gain SYSTEM privileges.,Microsoft Windows Hyper-V,Privilege Escalation
"Microsoft Windows MSHTML Platform contains a spoofing vulnerability that has a high impact to confidentiality, integrity, and availability.",Microsoft Windows MSHTML Platform,
"Cisco NX-OS contains a command injection vulnerability in the command line interface (CLI) that could allow an authenticated, local attacker to execute commands as root on the underlying operating system of an affected device.",Cisco NX-OS,Command Injection
Roundcube Webmail contains a cross-site scripting (XSS) vulnerability that allows a remote attacker to manipulate data via a malicious XML attachment.,Roundcube Webmail,Cross-Site Scripting
"Linux Kernel contains a use-after-free vulnerability in the nft_object, allowing local attackers to escalate privileges. ",Linux Kernel,
"OSGeo GeoServer JAI-EXT contains a code injection vulnerability that, when programs use jt-jiffle and allow Jiffle script to be provided via network request, could allow remote code execution.",OSGeo GeoServer JAI-EXT,Remote Code Execution
Progress Telerik Report Server contains an authorization bypass by spoofing vulnerability that allows an attacker to obtain unauthorized access.,Progress Telerik Report Server,an attacker to obtain unauthorized access
