shortDescription,company,vuln_type
"Jenkins User Interface (UI) contains an information disclosure vulnerability that allows users to see the names of jobs and builds otherwise inaccessible to them on the ""Fingerprints"" pages.",Jenkins User Interface,Information Disclosure
"Oracle Java SE and JRockit contains an unspecified vulnerability that allows remote attackers to affect confidentiality, integrity, and availability via vectors related to Java Management Extensions (JMX). This vulnerability can be exploited through sandboxed Java Web Start applications and sandboxed Java applets. It can also be exploited by supplying data to APIs in the specified component without using sandboxed Java Web Start applications or sandboxed Java applets, such as through a web service.",Oracle Java SE,remote attackers to affect confidentiality
Apache Tomcat contains an unspecified vulnerability that allows for remote code execution if JmxRemoteLifecycleListener is used and an attacker can reach Java Management Extension (JMX) ports. This CVE exists because this listener wasn't updated for consistency with the Oracle patched issues for CVE-2016-3427 which affected credential types.,Apache Tomcat,Remote Code Execution
Microsoft Win32k contains an unspecified vulnerability that allows for privilege escalation up to SYSTEM privileges.,Microsoft Win32k,Privilege Escalation
TP-Link Archer AX-21 contains a command injection vulnerability that allows for remote code execution.,TP-Link Archer AX-21,Remote Code Execution
"Apache Log4j2 contains a deserialization of untrusted data vulnerability due to the incomplete fix of CVE-2021-44228, where the Thread Context Lookup Pattern is vulnerable to remote code execution in certain non-default configurations.",Apache Log4j2,Remote Code Execution
"Oracle WebLogic Server contains an unspecified vulnerability that allows an unauthenticated attacker with network access via T3, IIOP, to compromise Oracle WebLogic Server.",Oracle WebLogic Server,an unauthenticated attacker with network access via t3
"MinIO contains a vulnerability in a cluster deployment where MinIO returns all environment variables, which allows for information disclosure.",MinIO,Information Disclosure
PaperCut MF/NG contains an improper access control vulnerability within the SetupCompleted class that allows authentication bypass and code execution in the context of system.,PaperCut MF,Authentication Bypass
"Google Chromium Skia contains an integer overflow vulnerability that allows a remote attacker, who has compromised the renderer process, to potentially perform a sandbox escape via a crafted HTML page. This vulnerability affects Google Chrome and ChromeOS, Android, Flutter, and possibly other products.",Google Chromium Skia,a remote attacker
"The Simple Network Management Protocol (SNMP) subsystem of Cisco IOS and IOS XE contains a vulnerability that could allow an authenticated, remote attacker to remotely execute code on an affected system or cause an affected system to reload.",Simple Network Management Protocol,
Apple macOS contains a use-after-free vulnerability that could allow for privilege escalation.,Apple,Privilege Escalation
"Google Chromium V8 Engine contains a type confusion vulnerability that allows a remote attacker to potentially exploit heap corruption via a crafted HTML page. This vulnerability could affect multiple web browsers that utilize Chromium, including, but not limited to, Google Chrome, Microsoft Edge, and Opera.",Google Chromium V8 Engine,a remote attacker to potentially exploit heap corruption via a crafted html page
Android Framework contains an unspecified vulnerability that allows for privilege escalation after updating an app to a higher Target SDK with no additional execution privileges needed.,Android Framework,Privilege Escalation
Novi Survey contains an insecure deserialization vulnerability that allows remote attackers to execute code on the server in the context of the service account.,Novi Survey,remote attackers to execute code on the server in the context of the service acc
Microsoft Windows Common Log File System (CLFS) driver contains an unspecified vulnerability that allows for privilege escalation.,Microsoft Windows Common Log,Privilege Escalation
"Apple iOS, iPadOS, macOS, and Safari WebKit contain a use-after-free vulnerability that leads to code execution when processing maliciously crafted web content. This vulnerability could impact HTML parsers that use WebKit, including but not limited to Apple Safari and non-Apple products which rely on WebKit for HTML processing.",Apple,Denial of Service
"Apple iOS, iPadOS, and macOS IOSurfaceAccelerator contain an out-of-bounds write vulnerability that allows an app to execute code with kernel privileges.",Apple,Denial of Service
Veritas Backup Exec (BE) Agent contains a file access vulnerability that could allow an attacker to specially craft input parameters on a data management protocol command to access files on the BE Agent machine.,Veritas Backup Exec,
Veritas Backup Exec (BE) Agent contains an improper authentication vulnerability that could allow an attacker unauthorized access to the BE Agent via SHA authentication scheme.,Veritas Backup Exec,
Veritas Backup Exec (BE) Agent contains a command execution vulnerability that could allow an attacker to use a data management protocol command to execute a command on the BE Agent machine.,Veritas Backup Exec,
"Microsoft Windows Certificate Dialog contains a privilege escalation vulnerability, allowing attackers to run processes in an elevated context.",Microsoft Windows Certificate Dialog,Privilege Escalation
Arm Mali GPU Kernel Driver contains an information disclosure vulnerability that allows a non-privileged user to make valid GPU processing operations that expose sensitive kernel metadata.,Arm Mali GPU Kernel,Information Disclosure
Synacor Zimbra Collaboration Suite (ZCS) contains a cross-site scripting vulnerability by allowing an endpoint URL to accept parameters without sanitizing.,Synacor Zimbra Collaboration Suite,Cross-Site Scripting
Microsoft Internet Explorer contains a memory corruption vulnerability that allows remote attackers to execute code or cause a denial of service via a crafted website.,Microsoft Internet Explorer,Denial of Service
"Samba contains a remote code execution vulnerability, allowing a malicious client to upload a shared library to a writable share and then cause the server to load and execute it.",Samba,Remote Code Execution
Fortra Cobalt Strike User Interface contains an unspecified vulnerability rooted in Java Swing that may allow remote code execution.,Fortra Cobalt Strike User,Remote Code Execution
"Fortra Cobalt Strike contains a cross-site scripting (XSS) vulnerability in Teamserver that would allow an attacker to set a malformed username in the Beacon configuration, allowing them to execute code remotely.",Fortra Cobalt Strike,Cross-Site Scripting
"Apple GPU drivers, included in iOS, iPadOS, and macOS, contain an out-of-bounds write vulnerability that may allow a malicious application to execute code with kernel privileges.",Apple GPU,Denial of Service
Arm Mali GPU Kernel Driver contains a use-after-free vulnerability that may allow a non-privileged user to gain root privilege and/or disclose information.,Arm Mali GPU Kernel,
Linux kernel contains a use-after-free vulnerability that allows for privilege escalation to gain ring0 access from the system user.,Linux,Privilege Escalation
"Google Chromium Network Service contains a use-after-free vulnerability that allows a remote attacker to potentially exploit heap corruption via a crafted HTML page. This vulnerability could affect multiple web browsers that utilize Chromium, including, but not limited to, Google Chrome, Microsoft Edge, and Opera.",Google Chromium Network Service,a remote attacker to potentially exploit heap corruption via a crafted html page
Arm Mali GPU Kernel Driver contains an unspecified vulnerability that allows a non-privileged user to achieve write access to read-only memory pages.,Arm Mali GPU Kernel,a non-privileged user to achieve write access to read-only memory pages
Adobe ColdFusion contains a deserialization of untrusted data vulnerability that allows for remote code execution.,Adobe ColdFusion,Remote Code Execution
Microsoft Office Outlook contains a privilege escalation vulnerability that allows for a NTLM Relay attack against another service to authenticate as the user.,Microsoft Office Outlook,Privilege Escalation
Microsoft Windows SmartScreen contains a security feature bypass vulnerability that could allow an attacker to evade Mark of the Web (MOTW) defenses via a specially crafted malicious file.,Microsoft Windows SmartScreen,
Fortinet FortiOS contains a path traversal vulnerability that may allow a local privileged attacker to read and write files via crafted CLI commands.,Fortinet FortiOS,Directory Traversal
"XStream contains a remote code execution vulnerability that allows an attacker to manipulate the processed input stream and replace or inject objects that result in the execution of a local command on the server. This vulnerability can affect multiple products, including but not limited to VMware Cloud Foundation.",XStream,Remote Code Execution
Plex Media Server contains a remote code execution vulnerability that allows an attacker with access to the server administrator's Plex account to upload a malicious file via the Camera Upload feature and have the media server execute it.,Plex Media Server,Remote Code Execution
Zoho ManageEngine ADSelfService Plus contains an unspecified vulnerability allowing for remote code execution when performing a password change or reset.,Zoho ManageEngine ADSelfService Plus,Remote Code Execution
Apache Spark contains a command injection vulnerability via Spark User Interface (UI) when Access Control Lists (ACLs) are enabled.,Apache Spark,Command Injection
"Teclib GLPI contains a remote code execution vulnerability in the third-party library, htmlawed.",Teclib GLPI,Remote Code Execution
"ZK Framework AuUploader servlets contain an unspecified vulnerability that could allow an attacker to retrieve the content of a file located in the web context. The ZK Framework is an open-source Java framework. This vulnerability can impact multiple products, including but not limited to ConnectWise R1Soft Server Backup Manager.",ZK Framework AuUploader,Remote Code Execution
"IBM Aspera Faspex could allow a remote attacker to execute code on the system, caused by a YAML deserialization flaw.",IBM Aspera Faspex,
The Director component in Mitel MiVoice Connect allows an authenticated attacker with internal network access to execute code within the context of the application.,Director,
The Mitel Edge Gateway component of MiVoice Connect allows an authenticated attacker with internal network access to execute commands within the context of the system.,Mitel Edge Gateway,
Cacti contains a command injection vulnerability that allows an unauthenticated user to execute code.,Cacti,Command Injection
"Microsoft Office Publisher contains a security feature bypass vulnerability that allows for a local, authenticated attack on a targeted system.",Microsoft Office Publisher,for a local
Microsoft Windows Common Log File System (CLFS) driver contains an unspecified vulnerability that allows for privilege escalation.,Microsoft Windows Common Log,Privilege Escalation
"Apple iOS, MacOS, Safari and iPadOS WebKit contain a type confusion vulnerability that leads to code execution when processing maliciously crafted web content. This vulnerability could impact HTML parsers that use WebKit, including but not limited to Apple Safari and non-Apple products which rely on WebKit for HTML processing.",Apple,Denial of Service
Microsoft Windows Graphic Component contains an unspecified vulnerability that allows for privilege escalation.,Microsoft Windows Graphic Component,Privilege Escalation
Intel ethernet diagnostics driver for Windows IQVW32.sys and IQVW64.sys contain an unspecified vulnerability that allows for a denial-of-service (DoS).,Intel,Denial of Service
TerraMaster OS contains a remote command execution vulnerability that allows an unauthenticated user to execute commands on the target endpoint.,TerraMaster OS,Remote Code Execution
"Fortra (formerly, HelpSystems) GoAnywhere MFT contains a pre-authentication remote code execution vulnerability in the License Response Servlet due to deserializing an attacker-controlled object.",Fortra,Remote Code Execution
Oracle E-Business Suite contains an unspecified vulnerability that allows an unauthenticated attacker with network access via HTTP to compromise Oracle Web Applications Desktop Integrator.,Oracle E-Business Suite,an unauthenticated attacker with network access via http to compromise oracle we
"Multiple SugarCRM products contain a remote code execution vulnerability in the EmailTemplates. Using a specially crafted request, custom PHP code can be injected through the EmailTemplates.",Multiple SugarCRM,Remote Code Execution
Telerik UI for ASP.NET AJAX contains an insecure direct object reference vulnerability in RadAsyncUpload that can result in file uploads in a limited location and/or remote code execution.,Telerik UI,Remote Code Execution
"Multiple Zoho ManageEngine products contain an unauthenticated remote code execution vulnerability due to the usage of an outdated third-party dependency, Apache Santuario.",Multiple Zoho ManageEngine,Remote Code Execution
CWP Control Web Panel (formerly CentOS Web Panel) contains an OS command injection vulnerability that allows remote attackers to execute commands via shell metacharacters in the login parameter.,CWP Control Web Panel,Command Injection
"Microsoft Exchange Server contains an unspecified vulnerability that allows for privilege escalation. This vulnerability is chainable with CVE-2022-41082, which allows for remote code execution.",Microsoft Exchange Server,Remote Code Execution
Microsoft Windows Advanced Local Procedure Call (ALPC) contains an unspecified vulnerability that allows for privilege escalation.,Microsoft Windows Advanced Local,Privilege Escalation
"TIBCO JasperReports Server contain a vulnerability which may allow any authenticated user read-only access to the contents of the web application, including key configuration files.",TIBCO JasperReports Server,
TIBCO JasperReports Library contains a directory-traversal vulnerability that may allow web server users to access contents of the host system.,TIBCO JasperReports Library,
Apple iOS contains a type confusion vulnerability when processing maliciously crafted web content leading to code execution.,Apple,
"Multiple versions of Fortinet FortiOS SSL-VPN contain a heap-based buffer overflow vulnerability which can allow an unauthenticated, remote attacker to execute arbitrary code or commands via specifically crafted requests.",Multiple,Remote Code Execution
Microsoft Defender SmartScreen contains a security feature bypass vulnerability that could allow an attacker to evade Mark of the Web (MOTW) defenses via a specially crafted malicious file.,Microsoft Defender SmartScreen,
"Citrix Application Delivery Controller (ADC) and Gateway, when configured with SAML SP or IdP configuration, contain an authentication bypass vulnerability that allows an attacker to execute code as administrator.",Citrix Application Delivery Controller,Authentication Bypass
The Veeam Distribution Service in the Backup & Replication application allows unauthenticated users to access internal API functions. A remote attacker can send input to the internal API which may lead to uploading and executing of malicious code.,Veeam Distribution Service,
The Veeam Distribution Service in the Backup & Replication application allows unauthenticated users to access internal API functions. A remote attacker can send input to the internal API which may lead to uploading and executing of malicious code.,Veeam Distribution Service,
"Google Chromium V8 Engine contains a type confusion vulnerability that allows a remote attacker to potentially exploit heap corruption via a crafted HTML page. This vulnerability could affect multiple web browsers that utilize Chromium, including, but not limited to, Google Chrome, Microsoft Edge, and Opera.",Google Chromium V8 Engine,a remote attacker to potentially exploit heap corruption via a crafted html page
Oracle Fusion Middleware Access Manager allows an unauthenticated attacker with network access via HTTP to takeover the Access Manager product.,Oracle Fusion Middleware Access,
"Google Chromium GPU contains a heap buffer overflow vulnerability that allows a remote attacker, who has compromised the renderer process, to potentially perform a sandbox escape via a crafted HTML page. This vulnerability could affect multiple web browsers that utilize Chromium, including, but not limited to, Google Chrome, Microsoft Edge, and Opera.",Google Chromium GPU,Buffer Overflow
Microsoft Windows Mark of the Web (MOTW) contains a security feature bypass vulnerability resulting in a limited loss of integrity and availability of security features.,Microsoft Windows Mark,
Microsoft Windows Mark of the Web (MOTW) contains a security feature bypass vulnerability resulting in a limited loss of integrity and availability of security features.,Microsoft Windows Mark,
Microsoft Windows Print Spooler contains an unspecified vulnerability that allows an attacker to gain SYSTEM-level privileges.,Microsoft Windows Print Spooler,an attacker to gain system-level privileges
Microsoft Windows Cryptographic Next Generation (CNG) Key Isolation Service contains an unspecified vulnerability that allows an attacker to gain SYSTEM-level privileges.,Microsoft Windows Cryptographic Next,an attacker to gain system-level privileges
Microsoft Windows contains an unspecified vulnerability in the JScript9 scripting language which allows for remote code execution.,Microsoft Windows,Remote Code Execution
Samsung mobile devices contain an improper access control vulnerability in clipboard service which allows untrusted applications to read or write arbitrary files. This vulnerability was chained with CVE-2021-25369 and CVE-2021-25370.,Samsung,
Samsung mobile devices using Mali GPU contains an improper access control vulnerability in sec_log file. Exploitation of the vulnerability exposes sensitive kernel information to the userspace. This vulnerability was chained with CVE-2021-25337 and CVE-2021-25370.,Samsung,
"Samsung mobile devices using Mali GPU contain an incorrect implementation handling file descriptor in dpu driver. This incorrect implementation results in memory corruption, leading to kernel panic. This vulnerability was chained with CVE-2021-25337 and CVE-2021-25369.",Samsung,
"Google Chromium V8 Engine contains a type confusion vulnerability that allows a remote attacker to potentially exploit heap corruption via a crafted HTML page. This vulnerability could affect multiple web browsers that utilize Chromium, including, but not limited to, Google Chrome, Microsoft Edge, and Opera.",Google Chromium V8 Engine,a remote attacker to potentially exploit heap corruption via a crafted html page
Apple iOS and iPadOS kernel contain an out-of-bounds write vulnerability which can allow an application to perform code execution with kernel privileges.,Apple,Denial of Service
Cisco AnyConnect Secure Mobility Client for Windows interprocess communication (IPC) channel allows for insufficient validation of resources that are loaded by the application at run time. An attacker with valid credentials on Windows could execute code on the affected machine with SYSTEM privileges.,Cisco AnyConnect Secure Mobility,Remote Code Execution
"Cisco AnyConnect Secure Mobility Client for Windows allows for incorrect handling of directory paths. An attacker with valid credentials on Windows would be able to copy malicious files to arbitrary locations with system level privileges. This could include DLL pre-loading, DLL hijacking, and other related attacks.",Cisco AnyConnect Secure Mobility,
"The GPCIDrv and GDrv low-level drivers in GIGABYTE App Center, AORUS Graphics Engine, XTREME Gaming Engine, and OC GURU expose functionality to read and write arbitrary physical memory. This could be leveraged by a local attacker to elevate privileges.",GPCIDrv,
"The GPCIDrv and GDrv low-level drivers in GIGABYTE App Center, AORUS Graphics Engine, XTREME Gaming Engine, and OC GURU II expose functionality to read/write data from/to IO ports. This could be leveraged in a number of ways to ultimately run code with elevated privileges.",GPCIDrv,
"The GPCIDrv and GDrv low-level drivers in GIGABYTE App Center, AORUS Graphics Engine, XTREME Gaming Engine, and OC GURU II expose functionality to read and write arbitrary physical memory. This could be leveraged by a local attacker to elevate privileges.",GPCIDrv,
"The GDrv low-level driver in GIGABYTE App Center, AORUS Graphics Engine, XTREME Gaming Engine, and OC GURU II exposes ring0 memcpy-like functionality that could allow a local attacker to take complete control of the affected system.",GDrv,
Synacor Zimbra Collaboration Suite (ZCS) allows an attacker to upload arbitrary files using cpio package to gain incorrect access to any other user accounts.,Synacor Zimbra Collaboration Suite,
"The overlayfs stacking file system in Linux kernel does not properly validate the application of file capabilities against user namespaces, which could lead to privilege escalation.",The,Privilege Escalation
"Fortinet FortiOS, FortiProxy, and FortiSwitchManager contain an authentication bypass vulnerability that could allow an unauthenticated attacker to perform operations on the administrative interface via specially crafted HTTP or HTTPS requests.",Fortinet FortiOS,Authentication Bypass
Microsoft Windows COM+ Event System Service contains an unspecified vulnerability that allows for privilege escalation.,Microsoft Windows COM,Privilege Escalation
"Microsoft Exchange Server contains an unspecified vulnerability that allows for authenticated remote code execution. Dubbed ""ProxyNotShell,"" this vulnerability is chainable with CVE-2022-41040 which allows for the remote code execution.",Microsoft Exchange Server,Remote Code Execution
"Microsoft Exchange Server allows for server-side request forgery. Dubbed ""ProxyNotShell,"" this vulnerability is chainable with CVE-2022-41082 which allows for remote code execution.",Microsoft Exchange Server,Remote Code Execution
"Multiple API endpoints of Atlassian Bitbucket Server and Data Center contain a command injection vulnerability where an attacker with access to a public Bitbucket repository, or with read permissions to a private one, can execute code by sending a malicious HTTP request.",Multiple API,Command Injection
A code injection vulnerability in the User Portal and Webadmin of Sophos Firewall allows for remote code execution.,,Remote Code Execution
"Zoho ManageEngine PAM360, Password Manager Pro, and Access Manager Plus contain an unspecified vulnerability that allows for remote code execution.",Zoho ManageEngine PAM360,Remote Code Execution
Trend Micro Apex One and Apex One as a Service contain an improper validation of rollback mechanism components that could lead to remote code execution.,Trend Micro Apex One,Remote Code Execution
The get_user and put_user API functions of the Linux kernel fail to validate the target address when being used on ARM v6k/v7 platforms. This allows an application to read and write kernel memory which could lead to privilege escalation.,The,Privilege Escalation
The Code Aurora audio calibration database (acdb) audio driver contains a stack-based buffer overflow vulnerability that allows for privilege escalation. Code Aurora is used in third-party products such as Qualcomm and Android.,Code Aurora,Buffer Overflow
Linux kernel fb_mmap function in drivers/video/fbmem.c contains an integer overflow vulnerability that allows for privilege escalation.,Linux,Privilege Escalation
"Linux kernel fails to check all 64 bits of attr.config passed by user space, resulting to out-of-bounds access of the perf_swevent_enabled array in sw_perf_event_destroy(). Explotation allows for privilege escalation.",Linux,Privilege Escalation
Microsoft Windows incorrectly parses shortcuts in such a way that malicious code may be executed when the operating system displays the icon of a malicious shortcut file. An attacker who successfully exploited this vulnerability could execute code as the logged-on user.,Microsoft Windows,
Microsoft Windows Common Log File System (CLFS) driver contains an unspecified vulnerability that allows for privilege escalation.,Microsoft Windows Common Log,Privilege Escalation
"Apple kernel, which is included in iOS, iPadOS, and macOS, contains an unspecified vulnerability where an application may be able to execute code with kernel privileges.",Apple,Denial of Service
"Google Chromium Mojo contains an insufficient data validation vulnerability that allows a remote attacker, who has compromised the renderer process, to potentially perform a sandbox escape via a crafted HTML page. This vulnerability could affect multiple web browsers that utilize Chromium, including, but not limited to, Google Chrome, Microsoft Edge, and Opera.",Google Chromium Mojo,a remote attacker
Certain QNAP NAS running Photo Station with internet exposure contain an externally controlled reference to a resource vulnerability which can allow an attacker to modify system files. This vulnerability was observed being utilized in a Deadbolt ransomware campaign.,Certain QNAP NAS,Remote Code Execution
D-Link DIR-820L contains an unspecified vulnerability in Device Name parameter in /lan.asp which allows for remote code execution.,D-Link DIR-820L,Remote Code Execution
