shortDescription,company,vuln_type
Microsoft MSHTML Framework contains a protection mechanism failure vulnerability that could allow an unauthorized attacker to bypass a security feature over a network.,Microsoft MSHTML Framework,
Microsoft Windows Remote Access Connection Manager contains a NULL pointer dereference that could allow an unauthorized attacker to deny service locally.,Microsoft Windows Remote Access,
Microsoft Windows Shell contains a protection mechanism failure vulnerability that could allow an unauthorized attacker to bypass a security feature over a network. ,Microsoft Windows Shell,
Microsoft Windows Remote Desktop Services contains an improper privilege management vulnerability that could allow an authorized attacker to elevate privileges locally.,Microsoft Windows Remote Desktop,
Microsoft Desktop Windows Manager contains a type confusion vulnerability that could allow an authorized attacker to elevate privileges locally.,Microsoft Desktop Windows Manager,
Microsoft Office Word contains a reliance on untrusted inputs in a security decision vulnerability that could allow an authorized attacker to elevate privileges locally.,Microsoft Office Word,
"React Native Community CLI contains an OS command injection vulnerability which could allow unauthenticated network attackers to send POST requests to the Metro Development Server and run arbitrary executables via a vulnerable endpoint exposed by the server. On Windows, attackers can also execute arbitrary shell commands with fully controlled arguments.",React Native Community CLI,Command Injection
SmarterTools SmarterMail contains a missing authentication for critical function vulnerability in the ConnectToHub API method. This could allow the attacker to point the SmarterMail instance to a malicious HTTP server which serves the malicious OS command and could lead to command execution. ,SmarterTools SmarterMail,
GitLab Community and Enterprise Editions contain a server-side request forgery vulnerability which could allow unauthorized external users to perform Server Side Requests via the CI Lint API. ,GitLab Community,
Sangoma FreePBX Endpoint Manager contains an OS command injection vulnerability that could allow for a post-authentication command injection by an authenticated known user via the testconnection -> check_ssh_connect() function. An attacker can leverage this vulnerability to potentially obtain remote access to the system as an asterisk user. ,Sangoma FreePBX Endpoint Manager,Command Injection
Sangoma FreePBX contains an improper authentication vulnerability that potentially allows unauthorized users to bypass password authentication and access services provided by the FreePBX admin.,Sangoma FreePBX,
"SolarWinds Web Help Desk contains a deserialization of untrusted data vulnerability that could lead to remote code execution, which would allow an attacker to run commands on the host machine. This could be exploited without authentication.",SolarWinds Web Help Desk,Remote Code Execution
Ivanti Endpoint Manager Mobile (EPMM) contains a code injection vulnerability that could allow attackers to achieve unauthenticated remote code execution.,Ivanti Endpoint Manager Mobile,Remote Code Execution
"Fortinet FortiAnalyzer, FortiManager, FortiOS, and FortiProxy contain an authentication bypass using an alternate path or channel that could allow an attacker with a FortiCloud account and a registered device to log into other devices registered to other accounts, if FortiCloud SSO authentication is enabled on those devices.",Fortinet FortiAnalyzer,Authentication Bypass
Linux Kernel contains an integer overflow vulnerability in the create_elf_tables() function which could allow an unprivileged local user with access to SUID (or otherwise privileged) binary to escalate their privileges on the system.,Linux Kernel,
"SmarterTools SmarterMail contains an unrestricted upload of file with dangerous type vulnerability that could allow an unauthenticated attacker to upload arbitrary files to any location on the mail server, potentially enabling remote code execution.",SmarterTools SmarterMail,Remote Code Execution
"SmarterTools SmarterMail contains an authentication bypass using an alternate path or channel vulnerability in the password reset API. The force-reset-password endpoint permits anonymous requests and fails to verify the existing password or a reset token when resetting system administrator accounts. This could allow an unauthenticated attacker to supply a target administrator username and a new password to reset the account, resulting in full administrative compromise of the SmarterMail instance.",SmarterTools SmarterMail,Remote Code Execution
"GNU InetUtils contains an argument injection vulnerability in telnetd that could allow for remote authentication bypass via a ""-f root"" value for the USER environment variable.",GNU InetUtils,Authentication Bypass
Microsoft Office contains a security feature bypass vulnerability in which reliance on untrusted inputs in a security decision in Microsoft Office could allow an unauthorized attacker to bypass a security feature locally. Some of the impacted product(s) could be end-of-life (EoL) and/or end-of-service (EoS). Users are advised to discontinue use and/or transition to a supported version.,Microsoft Office,
"Broadcom VMware vCenter Server contains an out-of-bounds write vulnerability in the implementation of the DCERPC protocol. This could allow a malicious actor with network access to vCenter Server to send specially crafted network packets, potentially leading to remote code execution.",Broadcom VMware,Remote Code Execution
"Synacor Zimbra Collaboration Suite (ZCS) contains a PHP remote file inclusion vulnerability that could allow for remote attackers to craft requests to the /h/rest endpoint to influence internal request dispatching, allowing inclusion of arbitrary files from the WebRoot directory.",Synacor Zimbra Collaboration Suite,
"Versa Concerto SD-WAN orchestration platform contains an improper authentication vulnerability in the Traefik reverse proxy configuration, allowing at attacker to access administrative endpoints. The internal Actuator endpoint can be leveraged for access to heap dumps and trace logs.",Versa Concerto SD-WAN,
Vite Vitejs contains an improper access control vulnerability that exposes content of non-allowed files using ?inline&import or ?raw?import. Only apps explicitly exposing the Vite dev server to the network (using --host or server.host config option) are affected.,Vite Vitejs,
Prettier eslint-config-prettier contains an embedded malicious code vulnerability. Installing an affected package executes an install.js file that launches the node-gyp.dll malware on Windows.,Prettier,
"Cisco Unified Communications Manager (Unified CM), Cisco Unified Communications Manager Session Management Edition (Unified CM SME), Cisco Unified Communications Manager IM & Presence Service (Unified CM IM&P), Cisco Unity Connection, and Cisco Webex Calling Dedicated Instance contain a code injection vulnerability that could allow the attacker to obtain user-level access to the underlying operating system and then elevate privileges to root.",Cisco Unified Communications Manager,
Microsoft Windows Desktop Windows Manager contains an information disclosure vulnerability that allows an authorized attacker to disclose information locally.,Microsoft Windows Desktop Windows,Information Disclosure
Gogs contains a path traversal vulnerability affecting improper Symbolic link handling in the PutContents API that could allow for code execution.,Gogs,Directory Traversal
Microsoft Office PowerPoint contains a code injection vulnerability that allows remote attackers to execute arbitrary code via a PowerPoint file with an OutlineTextRefAtom containing an invalid index value that triggers memory corruption.,Microsoft Office PowerPoint,Remote Code Execution
Hewlett Packard Enterprise (HPE) OneView contains a code injection vulnerability that allows a remote unauthenticated user to perform remote code execution.,Hewlett Packard Enterprise,Remote Code Execution
MongoDB Server contains an improper handling of length parameter inconsistency vulnerability in Zlib compressed protocol headers. This vulnerability may allow a read of uninitialized heap memory by an unauthenticated client.,MongoDB Server,
Digiever DS-2105 Pro contains a missing authorization vulnerability which could allow for command injection via time_tzsetup.cgi.,Digiever DS-2105 Pro,Command Injection
WatchGuard Fireware OS iked process contains an out of bounds write vulnerability in the OS iked process. This vulnerability may allow a remote unauthenticated attacker to execute arbitrary code and affects both the mobile user VPN with IKEv2 and the branch office VPN using IKEv2 when configured with a dynamic gateway peer.,WatchGuard Fireware OS,Remote Code Execution
ASUS Live Update contains an embedded malicious code vulnerability client were distributed with unauthorized modifications introduced through a supply chain compromise. The modified builds could cause devices meeting specific targeting conditions to perform unintended actions. The impacted product could be end-of-life (EoL) and/or end-of-service (EoS). Users should discontinue product utilization.,ASUS Live Update,
SonicWall SMA1000 contains a missing authorization vulnerability that could allow for privilege escalation appliance management console (AMC) of affected devices.,SonicWall SMA1000,Privilege Escalation
"Cisco Secure Email Gateway, Secure Email, AsyncOS Software, and Web Manager appliances contains an improper input validation vulnerability that allows threat actors to execute arbitrary commands with root privileges on the underlying operating system of an affected appliance.",Cisco Secure Email Gateway,threat actors to execute arbitrary commands with root privileges on the underlyi
"Fortinet FortiOS, FortiSwitchMaster, FortiProxy, and FortiWeb contain an improper verification of cryptographic signature vulnerability that may allow an unauthenticated attacker to bypass the FortiCloud SSO login authentication via a crafted SAML message. Please be aware that CVE-2025-59719 pertains to the same problem and is mentioned in the same vendor advisory. Ensure to apply all patches mentioned in the advisory.",Fortinet FortiOS,
Gladinet CentreStack and TrioFox contain a hardcoded cryptographic keys vulnerability for their implementation of the AES cryptoscheme. This vulnerability degrades security for public exposed endpoints that may make use of it and may offer arbitrary local file inclusion when provided a specially crafted request without authentication.,Gladinet CentreStack,
"Apple iOS, iPadOS, macOS, and other Apple products contain a use-after-free vulnerability in WebKit. Processing maliciously crafted web content may lead to memory corruption. This vulnerability could impact HTML parsers that use WebKit, including but not limited to Apple Safari and non-Apple products which rely on WebKit for HTML processing.",Apple,Denial of Service
"Sierra Wireless AirLink ALEOS contains an unrestricted upload of file with dangerous type vulnerability. A specially crafted HTTP request can upload a file, resulting in executable code being uploaded, and routable, to the webserver. An attacker can make an authenticated HTTP request to trigger this vulnerability. The impacted product could be end-of-life (EoL) and/or end-of-service (EoS). Users should discontinue product utilization.",Sierra Wireless AirLink ALEOS,
"Google Chromium contains an out of bounds memory access vulnerability in ANGLE that could allow a remote attacker to perform out of bounds memory access via a crafted HTML page. This vulnerability could affect multiple web browsers that utilize Chromium, including, but not limited to, Google Chrome, Microsoft Edge, and Opera.",Google Chromium,
OSGeo GeoServer contains an improper restriction of XML external entity reference vulnerability that occurs when the application accepts XML input through a specific endpoint /geoserver/wms operation GetMap and could allow an attacker to define external entities within the XML request.,OSGeo GeoServer,
RARLAB WinRAR contains a path traversal vulnerability allowing an attacker to execute code in the context of the current user.,RARLAB WinRAR,Directory Traversal
Microsoft Windows Cloud Files Mini Filter Driver contains a use after free vulnerability that can allow an authorized attacker to elevate privileges locally.,Microsoft Windows Cloud Files,
"D-Link Routers contains a buffer overflow vulnerability that has a high impact on confidentiality, integrity, and availability. The impacted products could be end-of-life (EoL) and/or end-of-service (EoS). Users should discontinue product utilization.",D-Link Routers,Buffer Overflow
Array Networks ArrayOS AG contains an OS command injection vulnerability that could allow an attacker to execute arbitrary commands.,Array Networks ArrayOS AG,Command Injection
"Meta React Server Components contains a remote code execution vulnerability that could allow unauthenticated remote code execution by exploiting a flaw in how React decodes payloads sent to React Server Function endpoints. Please note CVE-2025-66478 has been rejected, but it is associated with CVE-2025- 55182.",Meta React Server Components,Remote Code Execution
OpenPLC ScadaBR contains an unrestricted upload of file with dangerous type vulnerability that allows remote authenticated users to upload and execute arbitrary JSP files via view_edit.shtm.,OpenPLC ScadaBR,remote authenticated users to upload and execute arbitrary jsp files via view_ed
Android Framework contains an unspecified vulnerability that allows for information disclosure.,Android Framework,Information Disclosure
Android Framework contains an unspecified vulnerability that allows for privilege escalation.,Android Framework,Privilege Escalation
OpenPLC ScadaBR contains a cross-site scripting vulnerability via system_settings.shtm.,OpenPLC ScadaBR,Cross-Site Scripting
"Oracle Fusion Middleware contains a missing authentication for critical function vulnerability, allowing unauthenticated remote attackers to take over Identity Manager.",Oracle Fusion Middleware,
Google Chromium V8 contains a type confusion vulnerability that allows for heap corruption.,Google Chromium V8,for heap corruption
Fortinet FortiWeb contains an OS command Injection vulnerability that may allow an authenticated attacker to execute unauthorized code on the underlying system via crafted HTTP requests or CLI commands.,Fortinet FortiWeb,Command Injection
Fortinet FortiWeb contains a relative path traversal vulnerability that may allow an unauthenticated attacker to execute administrative commands on the system via crafted HTTP or HTTPS requests.,Fortinet FortiWeb,Directory Traversal
Gladinet Triofox contains an improper access control vulnerability that allows access to initial setup pages even after setup is complete.,Gladinet Triofox,access to initial setup pages even after setup is complete
Microsoft Windows Kernel contains a race condition vulnerability that allows a local attacker with low-level privileges to escalate privileges. Successful exploitation of this vulnerability could enable the attacker to gain SYSTEM-level access.,Microsoft Windows Kernel,a local attacker with low-level privileges to escalate privileges
WatchGuard Firebox contains an out-of-bounds write vulnerability in the OS iked process that may allow a remote unauthenticated attacker to execute arbitrary code.,WatchGuard Firebox,Remote Code Execution
Samsung mobile devices contain an out-of-bounds write vulnerability in libimagecodec.quram.so. This vulnerability could allow remote attackers to execute arbitrary code.,Samsung,Remote Code Execution
CWP Control Web Panel (formerly CentOS Web Panel) contains an OS command Injection vulnerability that allows unauthenticated remote code execution via shell metacharacters in the t_total parameter in a filemanager changePerm request. A valid non-root username must be known.,CWP Control Web Panel,Remote Code Execution
Gladinet CentreStack and Triofox contains a files or directories accessible to external parties vulnerability that allows unintended disclosure of system files.,Gladinet CentreStack,unintended disclosure of system files
Broadcom VMware Aria Operations and VMware Tools contain a privilege defined with unsafe actions vulnerability. A malicious local actor with non-administrative privileges having access to a VM with VMware Tools installed and managed by Aria Operations with SDMP enabled may exploit this vulnerability to escalate privileges to root on the same VM.,Broadcom VMware Aria Operations,
XWiki Platform contains an eval injection vulnerability that could allow any guest to perform arbitrary remote code execution through a request to SolrSearch.,XWiki Platform,Remote Code Execution
Dassault Systèmes DELMIA Apriso contains a code injection vulnerability that could allow an attacker to execute arbitrary code.,Dassault Syst,Remote Code Execution
Dassault Systèmes DELMIA Apriso contains a missing authorization vulnerability that could allow an attacker to gain privileged access to the application.,Dassault Syst,
Adobe Commerce and Magento Open Source contain an improper input validation vulnerability that could allow an attacker to take over customer accounts through the Commerce REST API.,Adobe Commerce,Remote Code Execution
Microsoft Windows Server Update Service (WSUS) contains a deserialization of untrusted data vulnerability that allows for remote code execution.,Microsoft Windows Server Update,Remote Code Execution
Motex LANSCOPE Endpoint Manager contains an improper verification of source of a communication channel vulnerability allowing an attacker to execute arbitrary code by sending specially crafted packets.,Motex LANSCOPE Endpoint Manager,Remote Code Execution
"Apple macOS, iOS, tvOS, Safari, and watchOS contain an unspecified vulnerability in JavaScriptCore that when processing web content may lead to arbitrary code execution. The impacted product could be end-of-life (EoL) and/or end-of-service (EoS). Users should discontinue product utilization.",Apple,
Kentico Xperience CMS contains an authentication bypass using an alternate path or channel vulnerability that could allow an attacker to control administrative objects.,Kentico Xperience CMS,Authentication Bypass
Kentico Xperience CMS contains an authentication bypass using an alternate path or channel vulnerability that could allow an attacker to control administrative objects.,Kentico Xperience CMS,Authentication Bypass
Microsoft Windows SMB Client contains an improper access control vulnerability that could allow for privilege escalation. An attacker could execute a specially crafted malicious script to coerce the victim machine to connect back to the attack system using SMB and authenticate.,Microsoft Windows SMB Client,Remote Code Execution
Oracle E-Business Suite contains a server-side request forgery (SSRF) vulnerability in the Runtime component of Oracle Configurator. This vulnerability is remotely exploitable without authentication.,Oracle E-Business Suite,
Adobe Experience Manager Forms in JEE contains an unspecified vulnerability that allows for arbitrary code execution.,Adobe Experience Manager Forms,for arbitrary code execution
"IGEL OS contains a use of a key past its expiration date vulnerability that allows for Secure Boot bypass. The igel-flash-driver module improperly verifies a cryptographic signature. Ultimately, a crafted root filesystem can be mounted from an unverified SquashFS image.",IGEL OS,for secure boot bypass
Microsoft Windows Agere Modem Driver contains an untrusted pointer dereference vulnerability that allows for privilege escalation. An attacker who successfully exploited this vulnerability could gain administrator privileges.,Microsoft Windows Agere Modem,Privilege Escalation
Microsoft Windows contains an improper access control vulnerability in Windows Remote Access Connection Manager which could allow an authorized attacker to elevate privileges locally.,Microsoft Windows,
SKYSEA Client View contains an improper authentication vulnerability that allows remote code execution via a flaw in processing authentication on the TCP connection with the management console program.,SKYSEA Client View,Remote Code Execution
Grafana contains a path traversal vulnerability that could allow access to local files.,Grafana,Directory Traversal
"Synacor Zimbra Collaboration Suite (ZCS) contains a cross-site scripting vulnerability that exists in the Classic Web Client due to insufficient sanitization of HTML content in ICS files. When a user views an e-mail message containing a malicious ICS entry, its embedded JavaScript executes via an ontoggle event inside a tag. This allows an attacker to run arbitrary JavaScript within the victim's session, potentially leading to unauthorized actions such as setting e-mail filters to redirect messages to an attacker-controlled address. As a result, an attacker can perform unauthorized actions on the victim's account, including e-mail redirection and data exfiltration.",Synacor Zimbra Collaboration Suite,Cross-Site Scripting
Linux Kernel contains a heap out-of-bounds write vulnerability that could allow an attacker to gain privileges or cause a DoS (via heap memory corruption) through user name space.,Linux Kernel,Denial of Service
Microsoft Internet Explorer contains an uninitialized memory corruption vulnerability that could allow for remote code execution. The impacted product could be end-of-life (EoL) and/or end-of-service (EoS). Users should discontinue product utilization.,Microsoft Internet Explorer,Remote Code Execution
"Microsoft Windows Common Log File System Driver contains a privilege escalation vulnerability that could allow a local, privileged attacker to bypass certain security mechanisms.",Microsoft Windows Common Log,Privilege Escalation
"Microsoft Windows contains an out-of-bounds write vulnerability in the InformationCardSigninHelper Class ActiveX control, icardie.dll. An attacker could exploit the vulnerability by constructing a specially crafted webpage. When a user views the webpage, the vulnerability could allow remote code execution. An attacker who successfully exploited this vulnerability could gain the same user rights as the current user. The impacted product could be end-of-life (EoL) and/or end-of-service (EoS). Users should discontinue product utilization.",Microsoft Windows,Remote Code Execution
Microsoft Windows Kernel contains an unspecified vulnerability in the TrueType font parsing engine in win32k.sys in the kernel-mode drivers that allows remote attackers to execute arbitrary code via crafted font data in a Word document or web page.,Microsoft Windows Kernel,Remote Code Execution
"Mozilla Firefox, SeaMonkey, and Thunderbird contain an unspecified vulnerability when JavaScript is enabled. This allows remote attackers to execute arbitrary code via vectors related to nsCSSFrameConstructor::ContentAppended, the appendChild method, incorrect index tracking, and the creation of multiple frames, which triggers memory corruption.",Mozilla Firefox,Remote Code Execution
Oracle E-Business Suite contains an unspecified vulnerability in the BI Publisher Integration component. The vulnerability allows unauthenticated attacker with network access via HTTP to compromise Oracle Concurrent Processing. Successful attacks can result in takeover of Oracle Concurrent Processing.,Oracle E-Business Suite,unauthenticated attacker with network access via http to compromise oracle concu
GNU Bash contains an OS command injection vulnerability which allows remote attackers to execute arbitrary commands via a crafted environment.,GNU Bash,Command Injection
"Jenkins contains a remote code execution vulnerability. This vulnerability that could allowed attackers to transfer a serialized Java SignedObject object to the remoting-based Jenkins CLI, that would be deserialized using a new ObjectInputStream, bypassing the existing blocklist-based protection mechanism.",Jenkins,Remote Code Execution
Juniper ScreenOS contains an improper authentication vulnerability that could allow unauthorized remote administrative access to the device.,Juniper ScreenOS,
Samsung mobile devices contain an out-of-bounds write vulnerability in libimagecodec.quram.so which allows remote attackers to execute arbitrary code.,Samsung,Remote Code Execution
Smartbedded Meteobridge contains a command injection vulnerability that could allow remote unauthenticated attackers to gain arbitrary command execution with elevated privileges (root) on affected devices.,Smartbedded Meteobridge,Command Injection
"Sudo contains an inclusion of functionality from untrusted control sphere vulnerability. This vulnerability could allow local attacker to leverage sudo’s -R (--chroot) option to run arbitrary commands as root, even if they are not listed in the sudoers file.",Sudo,
Libraesva Email Security Gateway (ESG) contains a command injection vulnerability which allows command injection via a compressed e-mail attachment.,Libraesva Email Security Gateway,Command Injection
"Fortra GoAnywhere MFT contains a deserialization of untrusted data vulnerability allows an actor with a validly forged license response signature to deserialize an arbitrary actor-controlled object, possibly leading to command injection.",Fortra GoAnywhere MFT,Command Injection
